keyword,title,url
Go-to-market strategy,How do you plan to market and promote your business?,https://www.quora.com/How-do-you-plan-to-market-and-promote-your-business-1
Go-to-market strategy,How to write a self-centred business plan when the money ...,https://www.quora.com/How-do-you-write-a-self-centred-business-plan-when-the-money-is-already-there-but-you-still-need-a-way-to-focus-and-organise-yourself-to-start-and-run-a-business-that-you-have-not-yet-started
Go-to-market strategy,What is the best approach to market an API?,https://www.quora.com/What-is-the-best-approach-to-market-an-API
Go-to-market strategy,Is it better to create your own product or resell another ...,https://www.quora.com/Is-it-better-to-create-your-own-product-or-resell-another-companys-product
Go-to-market strategy,How to get a hard-working talanted co-founder for my startup,https://www.quora.com/How-do-I-get-a-hard-working-talanted-co-founder-for-my-startup
Go-to-market strategy,I'm launching a startup that is a travel social network. Would it be ...,https://www.quora.com/Im-launching-a-startup-that-is-a-travel-social-network-Would-it-be-better-promote-it-with-travel-or-tech-bloggers-Should-I-send-them-a-Press-Release-or-a-personal-note
B2B marketing strategy,Which is the most effective market strategy to promote a brand in ...,https://www.quora.com/Which-is-the-most-effective-market-strategy-to-promote-a-brand-in-2019?top_ans=1477743649140366
B2B marketing strategy,What are some proven sales strategies for a service-based ...,https://www.quora.com/What-are-some-proven-sales-strategies-for-a-service-based-business
B2B marketing strategy,What is the best online marketing strategy for a granite ...,https://www.quora.com/What-is-the-best-online-marketing-strategy-for-a-granite-countertop-business
B2B marketing strategy,"My Facebook account got hacked, the email address ...",https://www.quora.com/My-Facebook-account-got-hacked-the-email-address-got-changed-by-the-hacker-and-meta-help-center-is-unable-to-help-What-do-I-do
B2B marketing strategy,My Facebook account was hacked and changed my phone ...,https://www.quora.com/My-Facebook-account-was-hacked-and-changed-my-phone-number-and-my-email-address-How-can-I-fix-it-25?top_ans=1477743729177627
B2B marketing strategy,My Facebook account and Messenger was hacked ...,https://www.quora.com/My-Facebook-account-and-Messenger-was-hacked-and-they-changed-all-my-login-information-How-can-I-recover-my-accounts-back?no_redirect=1
B2B marketing strategy,Someone hacked my Facebook account and changed ...,https://www.quora.com/Someone-hacked-my-Facebook-account-and-changed-my-email-address-my-phone-number-and-password-I-cant-sign-in-anymore-How-can-I-cancel-the-account
B2B marketing strategy,How do i recover my hacked Facebook messenger account,https://www.quora.com/How-do-i-recover-my-hacked-Facebook-messenger-account
Inbound marketing,Can you recommend any marketing blogs written by small ...,https://www.quora.com/Can-you-recommend-any-marketing-blogs-written-by-small-business-owners
Inbound marketing,"In WorkFlowy, how do I link to an inbound email?",https://www.quora.com/In-WorkFlowy-how-do-I-link-to-an-inbound-email
Inbound marketing,What are some ways to encourage small business clients ...,https://www.quora.com/What-are-some-ways-to-encourage-small-business-clients-to-invest-in-their-online-marketing-strategy
Inbound marketing,Francesco Mercuri,https://www.quora.com/profile/Francesco-Mercuri-1
Inbound marketing,What are the best ways to promote a software startup ...,https://www.quora.com/What-are-the-best-ways-to-promote-a-software-startup-through-online-marketing
Inbound marketing,"Which is the best email marketing tool, HubSpot or ...",https://www.quora.com/Which-is-the-best-email-marketing-tool-HubSpot-or-GetResponse
Inbound marketing,What will I learn at a marketing agency?,https://www.quora.com/What-will-I-learn-at-a-marketing-agency
Inbound marketing,"Designsetter,designsetter@gmail.com, Design Setter Reviews ...",https://zpmwiqpqzllpygxv.quora.com/Designsetter-designsetter-gmail-com-Design-Setter-Reviews-Strategy-and-Creative-Together-in-Perfect-Balance
Inbound marketing,What is Google Ads marketing?,https://www.quora.com/What-is-Google-Ads-marketing
Inbound marketing,DMInsights,https://dminsights.quora.com/
Inbound marketing,How do you pick a marketing agency to work with?,https://www.quora.com/How-do-you-pick-a-marketing-agency-to-work-with
Inbound marketing,Where can I find more about SEO and online marketing?,https://www.quora.com/Where-can-I-find-more-about-SEO-and-online-marketing
Inbound marketing,How to start an inbound call center business in Hyderabad,https://www.quora.com/How-do-I-start-an-inbound-call-center-business-in-Hyderabad?top_ans=291125767
Inbound marketing,What are the best online marketing service providers?,https://www.quora.com/What-are-the-best-online-marketing-service-providers?top_ans=340651554
Inbound marketing,What email marketing tool does your business currently use?,https://www.quora.com/What-email-marketing-tool-does-your-business-currently-use
Inbound marketing,What is the best way to learn email marketing for free?,https://www.quora.com/What-is-the-best-way-to-learn-email-marketing-for-free
Inbound marketing,"Without digital marketing, is it possible to run an industry?",https://www.quora.com/Without-digital-marketing-is-it-possible-to-run-an-industry
Inbound marketing,What are the most effective ways to market a new business ...,https://www.quora.com/What-are-the-most-effective-ways-to-market-a-new-business-with-a-limited-budget
Inbound marketing,Are digital marketing services in the UAE expensive?,https://www.quora.com/Are-digital-marketing-services-in-the-UAE-expensive
Inbound marketing,How to get inbound calls for my tech support centre,https://www.quora.com/How-can-I-get-inbound-calls-for-my-tech-support-centre
Inbound marketing,What are some websites for learning digital marketing ...,https://www.quora.com/What-are-some-websites-for-learning-digital-marketing-SEO-and-other-online-skills-for-free-or-cheap
Inbound marketing,Who is the best guide for digital marketing?,https://www.quora.com/Who-is-the-best-guide-for-digital-marketing
Inbound marketing,Should you embed videos in email marketing? What are ...,https://www.quora.com/Should-you-embed-videos-in-email-marketing-What-are-the-pros-and-cons
Inbound marketing,What is the best email marketing software for e-commerce?,https://www.quora.com/What-is-the-best-email-marketing-software-for-e-commerce
Inbound marketing,Why is a strong online presence crucial for business ...,https://www.quora.com/Why-is-a-strong-online-presence-crucial-for-business-growth-in-2025
Inbound marketing,Why is a strong online presence crucial for business ...,https://www.quora.com/Why-is-a-strong-online-presence-crucial-for-business-growth-in-2025
Inbound marketing,Where can I find top marketing talent?,https://www.quora.com/Where-can-I-find-top-marketing-talent
Inbound marketing,What are the most effective strategies to grow a YouTube ...,https://www.quora.com/What-are-the-most-effective-strategies-to-grow-a-YouTube-channel-in-2024-for-small-creators
Inbound marketing,Why is lifestyle marketing so successful for B2C businesses?,https://www.quora.com/Why-is-lifestyle-marketing-so-successful-for-B2C-businesses
Inbound marketing,How to write good emails for my email marketing,https://www.quora.com/How-do-I-write-good-emails-for-my-email-marketing
Inbound marketing,What is a basic G-Suite account?,https://www.quora.com/What-is-a-basic-G-Suite-account
Inbound marketing,What services does a lead generation agency typically offer?,https://www.quora.com/What-services-does-a-lead-generation-agency-typically-offer
Inbound marketing,Which companies are doing best in digital marketing?,https://www.quora.com/Which-digital-marketing-company-is-renowned?top_ans=1477743733845178
Inbound marketing,What are the most common digital marketing services?,https://www.quora.com/What-are-some-examples-of-digital-marketing-services?top_ans=1477743687869094
Inbound marketing,Has anybody had success when purchasing a list of email ...,https://www.quora.com/Has-anybody-had-success-when-purchasing-a-list-of-email-addresses
Growth hacking techniques,What is the best way to learn growth hacking?,https://www.quora.com/What-is-the-best-way-to-learn-growth-hacking
Growth hacking techniques,How to become a growth hacker,https://www.quora.com/How-can-I-become-a-growth-hacker
Growth hacking techniques,What is the best way to build a successful app company?,https://www.quora.com/How-do-I-setup-an-app-development-company?top_ans=36242934
Growth hacking techniques,What is better for the startup: Launching fast but unstable ...,https://www.quora.com/What-is-better-for-the-startup-Launching-fast-but-unstable-and-badly-designed-app-or-taking-time-and-launching-a-beautiful-and-stable-app
Growth hacking techniques,How to promote my website through SEO,https://www.quora.com/How-can-I-promote-my-website-through-SEO
Growth hacking techniques,How can Google AdWords help my business achieve a ...,https://www.quora.com/How-can-Google-AdWords-help-my-business-achieve-a-higher-ROI
Growth hacking techniques,How to launch one app from another app,https://www.quora.com/How-can-you-launch-one-app-from-another-app
How to write engaging content,I need a content writer. Will you write for me?,https://www.quora.com/I-need-a-content-writer-Will-you-write-for-me
How to write engaging content,How to find a content writer for my office,https://www.quora.com/How-can-I-find-a-content-writer-for-my-office
How to write engaging content,What are some organic ways to generate traffic to your ...,https://www.quora.com/What-are-some-organic-ways-to-generate-traffic-to-your-business?top_ans=379798735
How to write engaging content,What skills can college students learn to make money ...,https://www.quora.com/What-skills-can-college-students-learn-to-make-money-online
How to write engaging content,What are some skills I can learn at home to earn money?,https://www.quora.com/What-are-some-skills-I-can-learn-at-home-to-earn-money
Content marketing strategy,How to plan for a digital marketing content strategy,https://www.quora.com/How-do-I-plan-for-a-digital-marketing-content-strategy
SEO content strategy,How to plan your SEO strategy for any new project,https://www.quora.com/How-do-you-plan-your-SEO-strategy-for-any-new-project
SEO content strategy,"What do you do first, write the content or do the SEO ...",https://www.quora.com/What-do-you-do-first-write-the-content-or-do-the-SEO-keyword-research-which-keywords-to-rank-for-etc
SEO content strategy,What is the SEO strategy for a business directory website?,https://www.quora.com/What-is-the-SEO-strategy-for-a-business-directory-website
SEO content strategy,What is the relationship between technical SEO and ...,https://www.quora.com/What-is-the-relationship-between-technical-SEO-and-content-optimization
SEO content strategy,How to hire experts for SEO on my YouTube channel,https://www.quora.com/How-can-I-hire-experts-for-SEO-on-my-YouTube-channel
SEO content strategy,How to describe my title as a freelancer who does SEO and ...,https://www.quora.com/How-do-I-describe-my-title-as-a-freelancer-who-does-SEO-and-writing-services-SEO-copywriter
SEO content strategy,How to find a trusted expert to optimize the Wix website for ...,https://www.quora.com/How-do-I-find-a-trusted-expert-to-optimize-the-Wix-website-for-SEO
SEO content strategy,How many types of submissions are there in SEO?,https://www.quora.com/How-many-types-of-submissions-are-there-in-SEO
SEO content strategy,How can we find an Amazon SEO specialist job?,https://www.quora.com/How-can-we-find-an-Amazon-SEO-specialist-job
SEO content strategy,What are some effective link building strategies that can ...,https://www.quora.com/What-are-some-effective-link-building-strategies-that-can-help-improve-a-websites-authority-and-organic-search-visibility-while-also-maintaining-compliance-with-search-engine-guidelines
SEO content strategy,What is the best SEO agency in Pune?,https://www.quora.com/What-is-the-best-SEO-agency-in-Pune
SEO content strategy,What is the difference between PPC and CRO/SEO?,https://www.quora.com/What-is-the-difference-between-PPC-and-CRO-SEO
SEO content strategy,Is it worth paying for a keyword tool? What's the difference ...,https://www.quora.com/Is-it-worth-paying-for-a-keyword-tool-Whats-the-difference-between-free-and-premium-ones-Is-there-any-difference-at-all
SEO content strategy,How to make more sales less work on my website,https://www.quora.com/How-do-I-make-more-sales-less-work-on-my-website
SEO content strategy,What are some factors that affect whether or not Google will ...,https://www.quora.com/What-are-some-factors-that-affect-whether-or-not-Google-will-rank-your-websites-content
SEO content strategy,What are the most significant challenges in developing ...,https://www.quora.com/What-are-the-most-significant-challenges-in-developing-a-multilingual-enterprise-search-engine-that-can-effectively-handle-context-and-intent-across-different-languages-and-cultures
SEO content strategy,Why is my website not appearing at all in Google Search?,https://www.quora.com/Why-is-my-website-not-appearing-at-all-in-Google-Search
SEO content strategy,Who is the professional SEO expert in Delhi?,https://www.quora.com/Who-is-the-professional-SEO-expert-in-Delhi
SEO content strategy,How to create a business website - SEO - Quora,https://searchengineoptimisation.quora.com/How-to-create-a-business-website?ch=15&oid=110688789&share=02b6d5ff&target_type=question
SEO content strategy,Kiran Chabukswar,https://www.quora.com/profile/Kiran-Chabukswar
SEO content strategy,What is the best institution to take a digital marketing ...,https://www.quora.com/What-is-the-best-institution-to-take-a-digital-marketing-course-as-well-as-placement-support-in-Chennai
SEO content strategy,What is the best YouTube course in 2023?,https://www.quora.com/What-is-the-best-YouTube-course-in-2023
SEO tools for content marketers,How to earn in affiliate marketing - Group Buy SEO Tool - Quora,https://groupbuyseotool.quora.com/https-www-quora-com-How-do-I-earn-in-affiliate-marketing-answer-HennoSmith-1
AI for content generation,Ejike John Anumba,https://www.quora.com/profile/Ejike-John-Anumba
Marketing automation platforms,What is the cost of automation email marketing?,https://www.quora.com/What-is-the-cost-of-automation-email-marketing
Marketing automation platforms,How to explain email marketing? How can we send bulk ...,https://www.quora.com/How-can-you-explain-email-marketing-How-can-we-send-bulk-mail-at-once
Marketing automation platforms,How to make nonprofit direct mail campaigns more ...,https://www.quora.com/How-can-I-make-nonprofit-direct-mail-campaigns-more-effective-for-my-organizations
Marketing automation platforms,,https://ar.quora.com/%D9%85%D8%A7%D9%87%D9%8A-%D8%A7%D9%81%D8%B6%D9%84-%D8%A7%D9%84%D9%85%D9%88%D8%A7%D9%82%D8%B9-%D9%84%D9%86%D8%B4%D8%B1-%D8%B1%D8%A7%D8%A8%D8%B7-%D8%A7%D9%84%D8%A7%D8%AD%D8%A7%D9%84%D8%A9-1
